,text,tag,author,from_book
123,诗人总是写自己的生活。最好的作品都是悲剧，无论是悔恨，绝望或孤独。,绝望,叶芝,《叶芝诗选》
124,我们曾有过的作为和思索，,绝望,叶芝,《叶芝诗选》
125,她本来住在天堂，现在天堂失去了，她住不惯平凡人的平凡世界，因此，绝望之余，一头钻进地狱。,绝望,毛姆,《刀锋》
126,只有人们在半睡半醒的状态下才会觉得世界如此奇妙美好，而一旦醒来，就会觉得它荒谬可笑，荒谬可笑到叫人绝望的程度。,绝望,托马斯·哈代,《无名的裘德》
127,借酒浇愁不就是那班没出息的人们悲观绝望的时候用的办法吗？,绝望,托马斯·哈代,《无名的裘德》
128,当你跌落谷底的时候，不要绝望不要放弃，动起来，哪怕慢哪怕痛苦，情况已经是最差了，这时候无论往哪个方向前进，你都是往上的。,绝望,佚名,《一禅小和尚》
129,真正的智慧，是得到的时候坦然接受，失去的时候淡然面对。,绝望,佚名,《一禅小和尚》
130,一禅:师父，对一个人死心需要多久啊,绝望,佚名,《一禅小和尚》
131,我和你一起盖的罗马，你却和她拆了城墙。我就像一个洋葱，如果你愿意一层一层地剥开我的心，你会发现，你会诧异，你是我最压心低的秘密。如果你愿意一层一层的剥开我的心，你会鼻酸，你会流泪，除了你能看到的那些全心全意，还有绝望的气息。,绝望,紫堇轩,《听说每颗星都会寂寞》
132,生活就是个骨架，人们用希望对它进行了装点。希望破灭， 就只能看到森森白骨。到那个时候， 又有谁不会退缩呢？对于绝大多数普通人而言，长久陷入动荡和逼仄的生活不会产生什么正面的效果，相比于得到的磨炼，更多的其实是绝望。,绝望,杨时旸,《杨天乐买房记》
133,一个如今已经失联的朋友多年前和我讲过一句话，他说：钱就像手纸一样有用和没用。非常精辟，是吧？当你需要它的时候，往往都是急需，如果没有，你就会陷入无比的尴尬、焦虑和绝望之中，当你不需要它时，你甚至都不会想起它，从这个意义上讲，手纸和钱真的是一样的东西。,绝望,杨时旸,《并没有如愿以偿的人生》
134,悲哀并不是绝望，而上帝却把它像兄弟般凑合在一起便使两者彼此决不让对方单独留下来陪伴我们。,绝望,缪塞,《佚名》
135,最美丽的诗歌，是最绝望的诗歌，有些不朽的篇章是纯粹的眼泪,绝望,缪塞,《佚名》
136,以前柔韧的肌肤、强健的肌肉、坚固的牙齿乃至整个身体，如今已经不复存在；剩下那颗绝望的灵魂也将逐渐死去。是的，死亡正在一分一秒地、慢慢地吞噬着我；可怕的是，我根本无法抗拒。现在，无论我做什么，都能感觉到死亡的来临。每走一步，每一个动作或者每一次呼吸，好像都在加速奔向死亡。我们所做的一切：呼吸、睡觉、喝水、吃饭、工作甚至做梦，都是为了死亡。总而言之，生就是死！,绝望,莫泊桑,《漂亮朋友》
137,在这个世界上，没有人救你这件事情不是很正常吗？,绝望,南派三叔,《盗墓笔记》
138,绝望是一种最大的情绪，它可以吞噬掉一切。有一刻我甚至意识到，我对于生命已经没有太多的依恋了。要么让我知道这背后的一切，要么就让我死在去了解这一切的路上吧。 这是我应得的报应，因为我的执念，已经害死了好多人，我如果不死，那这个世界真是太不公平了。,绝望,南派三叔,《盗墓笔记》
139,绝望是那些坚持只看结局，放弃一切希望的人所感受到的煎熬。,绝望,约翰·罗纳德·瑞尔·托尔金,《指环王》
