,text,tag,author,from_book
0,今年春，诸事忙过，我从柜子里取出五本笔记，摞在床头边，深宵临睡，一页一页读下去，发呆、出神、失声大笑，自己哭起来：我看见死去的木心躺在灵床上，又分明看见二十多年前大家围着木心，听他讲课……我们真有过漫漫五年的纽约聚会么？瞧着满纸木心讲的话，是我的笔记，也像是他的遗物。,怀念,陈丹青,《张岪与木心》
1,相见不如怀念，距离有美有朦胧，真如相守，也许只会剩下平凡，归于平淡。,怀念,辰东,《遮天》
2,那些被偷走时光中的际遇，那些不散场的人们，都留在了这本书中。最终，我们不断告别，偶尔怀念。,怀念,祝小兔,《时光不老，我们不散》
3,我怀念的并不是青春本身，而是在那个时间段里，你以为自由是永远的，你可以去任何地方。,怀念,独木舟,《万人如海一身藏》
4,其实也不会在闭眼的时候回忆我走过了谁人的生命，你们又如何怀念我。不会像胶片拉过一样追忆往事画面，譬如一九九九年的某个夜晚，谁问了谁的泪，谁又为谁透支了半生的衷情。生命不及百年，不及宇宙亿万分之一的瞬间。有今生无下世，我只信古词里的“生死两茫茫”，”月夜松冈“。,怀念,七堇年,《尘曲》
5,我离开伊宁,怀念,七堇年,《尘曲》
6,八八年,怀念,李祐汀,《请回答1988》
7,南京的七月热得不像话，我窝在房间里，赤着脚，在地板上跑来跑去，给花浇水，那些花是我在春风吹拂着的季节里种下的。,怀念,白槿湖,《如果巴黎不快乐》
8,为什么我还会有难以排遣的寂寞心情和压抑不住的强烈怀念？为什么我会如此激动？如此敏感？如此脆弱？平日司空见惯一向无动于衷的风景，乃至树叶的簌响，鸟类的呢喃，一朵云的形状，一枝花的姿态，一个音符，甚或一籁俱寂都会使得我深受感动，动辄热泪盈眶。,怀念,王朔,《动物凶猛》
9,秦淮河的水是碧阴阴的;看起来厚而不腻，或者是六朝金粉所凝么?我们初上船的时候，天色还未断黑，那漾漾的柔波是这样的恬静，委婉，使我们一面有水阔天空之想，一面又憧憬着纸醉金迷之境了。,怀念,朱自清,《朱自清散文集》
10,你我舍不得那首老情歌，听它的人是否怀念过,怀念,赵晨阳,《漂亮的李慧珍》
11,往事如风，如影随形。路在何方，梦已照明。,怀念,,
12,我们都有过去，我们一样怀念着过去的那一半。只是，人要活下去，要再寻幸福，这并不是否定了过去的爱情。,怀念,三毛,《稻草人手记》
13,红尘万里，很多人遇到了，散失了，误解了，错过了，所以，到年老仍是赤心怀念的人，不是每个人都可以拥有的。,怀念,梦入神机,《阳神》
14,忘不了就不要忘记，但有些人注定只能怀念。,怀念,辰东,《神墓》
15,即使早已成为过去，也会一直在生命里息息纠缠，控制不了的苦苦怀念使一颗心长年沉溺在追忆里，不肯浮出来与现实面对。曾到过美得无法形容的彼岸，所以在尘世里耿耿于怀，经历那样的深刻，让人不但难以割舍反而渴望继续追寻。然而这世上消逝得最快的永是最美的时光，一去不返后只余午夜梦回，醒来时让人肝肠寸断。,怀念,安宁,《温暖的弦》
16,越成功就越觉得原来这些都不是自己想要的，反而会怀念以前没有被功利心污染的岁月。有时候午夜梦回，醒来后总觉得心口有个洞，开始不知道是什么，随着一年一年过去，有一天终于明白，原来心底一直有着一个歉疚很深的结。,怀念,安宁,《温暖的弦》
17,有相聚就有离别，人生的百转千回中，有些人值得永远怀念，谢谢他陪著走一程。,怀念,尾田荣一郎,《海贼王》
18,失去的爱情，总是令人怀念的，这三个外国人，开始天天想念饺子，想一群失恋的人般曾经沧海起来，做什么菜伺候都难为水哦。,怀念,三毛,《温柔的夜》
19,我就是这样一天天老下去了。从这个样子你决看不出我每天每夜每小时每一分钟都在想入非非，怀念着十七岁时见到的紫色天空，岸边长满绿色芦苇的河流，还有我的马兄弟。,怀念,王小波,《绿毛水怪》
20,你走了真好，不然总担心你什么时候还要走。 你来过了一下子，我怀念了一辈子,怀念,佚名,《一禅小和尚》
21,一禅：师父,怀念,佚名,《一禅小和尚》
22,天上的风雨来了，鸟儿躲在它的巢里，心中的风雨来了，我只躲到你的怀里。,怀念,冰心,《繁星·春水》
23,小小的花 也想抬起头来 感谢春光的爱 然而深厚的恩慈 反使他终于沉默 母亲呵! 你是那春光么。,怀念,冰心,《母亲》
24,父亲呵！出来坐在月明里，我要听你说你的海。,怀念,冰心,《繁星·春水》
25,母亲，倘若你梦中看见一只很小的白船儿， 不要惊讶他无端入梦。 这是你至爱的女儿含着泪叠的， 万水千山，求他载着她的爱和悲哀归去。,怀念,冰心,《佚名》
26,母亲啊！你是荷叶，我是红莲，心中的雨点来了，除了你，谁是我在无遮拦天空下的荫蔽？,怀念,冰心,《佚名》
27,我的心是一座浸泡在海水中的宫殿。多年之后，你会记得它，也许忘却它。最终，你会怀念它。这种悲哀与击伤。这种怜悯与温 柔。这空无而充盈的力量。,怀念,安妮宝贝,《眠空》
28,男女之间，若只以好奇和欲望来做动力，一旦占有或产生厌倦之心，关系就失去行进的动力。如同被嚼过的甘蔗渣滓，榨取完尽甜美可见的汁液，只能被丢弃。所以人常说，分手之后，相见不如怀念。,怀念,安妮宝贝,《眠空》
29,曾经发生过的事情不可能忘记，只不过是想不起而已。,怀念,宫崎骏,《千与千寻》
30,在大多数人心中，自己的故乡后来会成为一个点，如同亘古不变的孤岛。,怀念,紫式部,《源氏物语》
31,心迹未予外人阅，花枝一束故人香。,怀念,紫式部,《源氏物语》
32,当你抬头仰望星空，当你俯瞰着苍茫如同群兽蛰伏般的大地。 你可曾看到了我？,怀念,丁墨,《美人为馅》
33,宇宙最简单的存在， 交错复转。 生命最繁复的形式， 朝失暮得。 可以覆盖每一天， 可以占据每一年。 错失依旧会复得。 于我虚无的梦境中， 他的名字， 终不会被时光掩盖。,怀念,丁墨,《美人为馅》
34,"“Did I scare you?"" “No."" “Can I kiss you?"" “Yes.""",怀念,施定柔,《遇见王沥川》
35,对我而言，杨建南和林澜相处的世界完全是另外一个维度的事，我不想知道，跟我也没有关系。在我的维度里，林澜只是林澜，跟任何人都没有关系。我只要不翻开那张卡片，另外那个维度就不会对我打开。,怀念,江南,《上海堡垒》
36,真是见鬼，我心里嘀咕。遇上这个女人，一定是个劫数，我记得我大学时候可以为了饭里的沙子跟食堂大师傅从门里揪打到门外，也算一个很直接的人。可是我每次遇见林澜，都是一个心情，无声无息的，很安静。我承认在过去很长的时间里我一直觉得这个女人的存在困扰我很厉害，可惜每次听到她的声音看到她的短信听见她走路时候低低地哼着歌，我的一切躁动不安也就烟消云散。,怀念,江南,《上海堡垒》
37,远处，一声声轻吟像情人的私语，天际，一缕缕温馨映红天地；风中，那飘舞的身影追云逐日，梦里，是谁在找寻那往日的足迹？,怀念,,
38,说句话吧，老朋友，让我再听听你的声音。我们曾共享苏维埃的光荣，举杯痛饮红牌伏特加，杯中沉浮着十万年历史的老冰。,怀念,江南,《龙族3·黑月之潮》
39,我想念的是那个时候全情付出的自己。怀念的是奋不顾身的勇气,怀念,白一骢,《约会专家》
40,从今要见庐山面，画作屏风静处看。,怀念,张耒,
41,这世间为什么总是这么宁静呢？大约因为死亡累积得太多，因为死的事远远多于生的事吧。,怀念,李娟,《冬牧场》
42,鸟飞反故乡兮，狐死必首丘。,怀念,屈原,《楚辞》
43,有时候我们以为放弃的是一段感情，其实我们放弃的是一种人生。我不希望重逢时你不好，或者我希望你事业好、爱情不好，这样你才会怀念我吧。可是我们的感情也不好，不然你怎么舍得放弃。,怀念,吴念真,《这些人，那些事》
44,有时候我们以为放弃的是一段感情 其实我们放弃的是一种人生 这不是我的故事 但不知为什么每当跟别人说起总会哽咽 我不希望重逢时你不好 或者我希望你事业好 爱情不好 这样你才会怀念我吧 可是我们的感情也不好 不然你怎么舍得放弃,怀念,吴念真,《这些人，那些事》
45,“齐家屯的生活是没有空白的，像古典的油画那样，充满着浓郁得化不开的色彩。一切都是浓烈和温热的：铺着厚厚乌拉草的火炕、铜烟锅里的关东烟和莫合烟、厚实的高粱饭、六十五度的高粱酒……但这一切，又都在宁静与平和中流逝着，像屯子边上的小溪一样。”,怀念,刘慈欣,《三体》
46,为什么我总是记得那些无聊的小事情。可是就是这些小事情，才是我最怀念的。,怀念,彼特·道格特,《飞屋环游记》
47,与其怀念，不如向往，与其向往，不如该放就放去远方。,怀念,张嘉佳,《从你的全世界路过》
48,"与其怀念,不如向往,与其向往,不如该放就放去远方。",怀念,张嘉佳,《从你的全世界路过》
49,生命的延续有多种展现方式，除了世代衍息，还有带着对已逝者的怀念继续好好生活，不要忘记他们，就是给他们最好的祝福,怀念,阿德里安·莫利纳,《寻梦环游记》
50,我经常怀念童年，它经久耐用，质量良好。,怀念,宫崎骏,《龙猫》
51,喧哗者不真诚，最真挚的怀念也是没有墓碑形式的。,怀念,梅尔维尔,《白鲸》
52,"那为什么这里摆满了风信子，风信子代表什么？爱情,嫉妒,悲伤,怀念,还有赌注。",怀念,匪我思存,《千山暮雪》
53,习惯会束缚人的手脚。我们努力工作只为了那么一个目标，如愿以偿之后，却又开始怀念日复一日的劳碌生活。,怀念,阿加莎·克里斯蒂,《东方快车谋杀案》
54,梦的最后在绿色中滑落的那个绿色，有可能是留在心中的北山杉。,怀念,川端康成,《古都》
55,只有在朦胧黯淡时才念及灯火光亮，只有在漫天飞雪时才怀念阳光温暖，只有在失去那笑容时才知道那是真情。然真爱已逝，如今只能在梦中相见.....,怀念,HEHE,《浪漫传说》
56,怀念一个人有很多种方式，用文字来记录的人，常常使我特别佩服，尤其是在看完后使这个人物形象立体起来的，更让人敬佩。这篇“怀念世棠”，让我看到了一个活灵活现的讲故事者，也看到了他心中的寂寞。对好朋友的描写不是几句舍不得，我想你，我念你，而是发自内心对情感的一种抒发，当然可以借助很多的事和物。,怀念,张晓风,《星星都已经到齐了》
57,我同你就像最初的两个人，亚当和夏娃，在世界创建的时候没有任何可遮掩的，我们现在在它的末日同样一丝不挂，无家可归。我和你是几千年来在他们和我们之间，在世界上所创造的不可胜数的伟大业绩中最后的怀念，为了悼念这些已经消失的奇迹，我们呼吸，相爱，哭泣，互相依靠，互相贴紧。,怀念,帕斯捷尔纳克,《日瓦戈医生》
58,荒诞人究竟是什么？就是不为永恒做任何事情，又不否定永恒的人。他并非对怀念一窍不通，但喜爱自己的勇气和推理胜过怀念。,怀念,阿尔贝·加缪,《西西弗的神话》
59,我捕捉着梦境，回味着梦乡。,怀念,普希金,《普希金诗选》
60,常常会这样，恍惚间好似突然回到了高中的某个中午。风扇嗡嗡地在头顶轰响，无聊地含着棒棒糖伏在课桌赶作业。窗外蝉鸣裹挟着绿得滴油的盛夏树叶的气息一起吹进了教室。时光缓慢流淌，日子好像怎么也望不到头。而现在想到总是很怀念，怀念着不用想那么多的日子。,怀念,佚名,《网易云音乐热评》
61,别说怀念我，向来怀念不实在。,怀念,李宫俊,《李宫俊的诗》
62,晚间你的纪念诗歌朗诵会，在下午,怀念,白鹤林,《白鹤林诗集》
63,“那天我们都喝醉了，也都哭了，互相说了许多肝胆相照的话，真是难忘的一夜。几天后，我和北雁正式举行了婚礼，她父母单独找我谈了一次话，问我是不是隐瞒了年龄。我跟老人家说，我从一生出来就显得比别的孩子老。1997年过去了，我很怀念它。”,怀念,冯小刚,《甲方乙方》
64,1997年过去了，我很怀念它,怀念,冯小刚,《甲方乙方》
65,我选择留在我自己的岁月里了。,怀念,王家卫,《一代宗师》
66,月似当时，人似当时否？,怀念,纳兰性德,《纳兰词》
67,木讷而健忘的灰色老屋，曾经覆他载他在烈日中在寒流中蔽他翼他的那老屋，终于死了，只留下满园子的树木，那些重碧交翠的灵魂，做他无言的见证。,怀念,余光中,《记忆像铁轨一样长》
68,我深深地怀念那个摩肩抵肘的时代。站在今日画了黄线的整洁月台上，总觉得少了一点什么，直到记起了从前那一声汽笛长啸。,怀念,余光中,《记忆像铁轨一样长》
69,前尘隔海，古屋不再。,怀念,余光中,《听听那冷雨》
70,怀念太奢侈，只好羡慕谁年少无知。,怀念,这么远那么近,《我知道你没那么坚强》
71,在一起的时候，总是很难感受到离别的意义，只有分开以后，才会怀念以前的日子。,怀念,八月长安,《最好的我们》
72,谢舜珲平静健康地活到八十一岁，无疾而终。他一直怀念她。,怀念,笛安,《南方有令秧》
73,看见了吗？那两只白鸽子，它们是屈原遗落在沙滩上的白鞋子，让我们和河水一起，穿上它们吧。,怀念,笛安,《告别天堂》
74,陌生人的雨伞打湿校服的下摆，某人的西装传来浓烈的樟脑球气味，旁人的体温紧贴后背，混浊的空调风肆意地扑面而来。,怀念,新海诚,《言叶之庭》
75,我又独自展开了地图，细细地看着每条街，每条胡同，回忆是无法记出详细年月的，常常会由一条小胡同，一个不相干的感触，把思路牵回到自己的童年，想起我的住室，我的小床，我的玩具和伴侣，......一环跟着一环，故事既无关系 年月也不衔接，思想就是这么个奇妙的东西。,怀念,林海音,《城南旧事》
76,好久没有感觉出夏日的气息了。海潮的清香，遥远的汽笛，女孩肌体的感触，洗发水的柠檬味儿，傍晚的和风，飘渺的憧憬，以及夏日的梦境……,怀念,村上春树,《且听风吟》
77,我们像怀念父亲一样怀念乔布斯。他不骄纵我们的欲望，他如山一样高大，他看一眼远方，然后看一眼我们说，孩子，这个好。你得要这个。,怀念,罗振宇,《时间的朋友》
