,text,tag,senti_polarity
0,	【富含哲理的句子】在面临作决定时，首先，应先问问自己做这个决定到底是为什么？有什么目的？如果做此决定会产生何种后果？这样能促使你三思而后行，避免冲动。人生最大的痛苦是痴迷，人生最大的羞辱是献媚，人生最大的危险是贪婪。人生最大的烦恼是名利，人生最大的可恶是淫乱，人生最大的善行是奉献！喜爱别人的才能，莫如学习人家的勤奋，恭维别人的长处，莫如责备自己的短处！滴自己的汗，吃自己的饭，自己的事情自己做，才能做最好的自己。	,正能量,positive
1,"	昨天诚可贵，明天价更高，若为今天故，二者都要抛。人生只有三天，做人不能只停留在过去，或寄梦于未来，唯独忘记了最重要的现在!需要感谢生命中每个朋友,成就我生活中的每一天因过去的相处说声感谢,因未来的相助说声拜托,更想因一生一世的朋友说声友情永存!也许有些人很可恶，有些人很卑鄙。所以请原谅所有你见过的人，好人或者坏人。	",正能量,positive
2,	世界上的万事万物就像一个无仁的核桃，到处不见一点果仁，即使它真的存在，你也不可能在壳中找到它。你可以到别处去寻觅，通常只有碰巧才能找到它。“热爱生活，要多感谢它。别靠胆小躲避它的挑战来显示你的感激，而要尽力超越一点你所能的范围去生活，这样你就会发现，你的能力远比你梦想的要强得多。”	,正能量,positive
3,	有时候，同样的一件事情，我们可以去安慰别人，却说服不了自己。——每个人，在困惑苦闷的时候，都需要身边有朋友能够开解一下自己，其实，并非我们不懂得那些道理，只是我们特别需要听到别人把它再复述出来，以来验证和坚定那些道理的真理性。生活中会有各种各样的担当压在我们肩上，就算我们竭尽全力，也不可能把所有的问题都一肩扛，就像在一望无际的麦田里拾麦穗，前方可能会有更大更好的麦穗，关键是要拾起最适合自己的麦穗，理性的权衡，正确的取舍，才有可能收获最有价值的人生。	,正能量,positive
4,	【简单生活】幸福是什么？在我看来，幸福来源于“简单生活”。文明只是外在的依托，成功、财富只是外在的荣光，真正的幸福来自于发现真实独特的自我，保持心灵的宁静。如果通往成功的电梯出了故障，请你走楼梯，一步一步来。只要还有楼梯，或是任何梯子，通往你想去的地方，电梯有没有故障都是无关紧要的事了，重要的是你不断地一步一步往上爬。	,正能量,positive
5,	【哲理语录经典语录】有些东西，放弃绝非如嘴上说的那么轻易。幻想着的东西仿佛天际中的星星，永远也不可能摘下来的。你只有仰望着，用这种最费力的姿势，来遥望它的闪烁美丽。放手，真能够像松开一样物品那么简单吗？人生无完美，曲折亦风景。有时你觉得步履沉重，前行缓慢，或许那是在爬上坡路；别把失去看得过重，放下昨天，珍惜今天，心向未来。既然时光永不回头，人生亦当无悔。做好当下，是人生最好的选择。	,正能量,positive
6,	力能胜贫穷，谨能胜灾祸，祸难入慎家之门，严谨慎重，智慧之母，做大事业须慎其终始，慎终如始，则无败事，谨慎的人才能稳操胜券！古人箴言：“求名者，因好色欲而名必败；求利者，因好色欲而必丧利；居家者，因好色欲而家弃必荒；为官者，因好色欲而官业必堕”！勤奋努力，付出最终总会有回报；诚实守信，人格最终总会受尊重；宽容厚道，路子最终总会越宽广；心地善良，友情最终总会越来越深！	,正能量,positive
7,	我以为“隐身”别人就找不到我了，没有用的，像我这样的人，无论在哪里，都像漆黑夜里的萤火虫，够鲜明够出众。名望一闪即逝，钱财振翅而飞，走红是个意外，久长唯有人品。做事要先做人，做人要先先立德！压服比心服短命，权威比权势长寿。企图用钢丝来绑住对方的心，对方的心滑脱得更远。	,正能量,positive
8,	“圣人”的境界，有时不像我们想象的那么高不可攀——面对快乐守的品质。对自己的行为作出几种不同的解释时，我们就知道，自己正在掩饰某些东西。世上最宽阔的是海洋，比海洋更宽阔的是天空，比天空更宽阔的是人的胸怀。多余的财富只能够买多余的东西，人的灵魂必须的东西，是不需要花钱买的。	,正能量,positive
9,	以前提到结婚，想到：天长地久，现在提到结婚，想到：能撑多久。结婚前男人借钱也要让女人吃好，结婚后女人借钱也要让男人吃好。用加法的方式去爱人；用减法的方式去怨恨；用乘法的方式去感恩。时间就是这个样子，徜徉其中尚觉得慢，一旦定睛回望，弹指之间。沉默是应对所有问题的最佳答案，微笑是在所有情况下的最佳反应。关于过去，关于你，告一段落。关于未来，关于我，敬请期待。再铁的异性朋友，当无论谁谈上恋爱，距离都会拉远，这是个事实。为了一个你，我和多少人淡了关系。结果，你走了，他们也没了。	,正能量,positive
10,	【妙语生花】喝茶只需两个动作——拿起和放下。人生亦如喝茶，虽看着繁杂，其实又何尝不似如此简单？有些事何必纠结于心？有些人何必纠缠不清？很多时候，看淡一些，看轻一些，世事原本可以像喝茶一样，不过拿起和放下罢了。她说，后来我知道，必须接受生命里注定残缺和难以如愿的部分。要接受那些被禁忌的不能见到光明的东西。在这个世间。有一些无法抵达的地方，无法靠近的人，无法完成的事情，无法占有的感情，无法修复的缺陷。	,正能量,positive
11,	【哲理语句】你永远要宽恕众生，不论他有多坏，甚至他伤害过你，你一定要放下，才能得到真正的快乐。越来越任性是因为爱得太深。越来越沉默是因为伤得太痛。越来越礼貌是因为失望透顶。什么都可以不好，心情不能不好，什么都可以缺乏，自信不能缺乏，什么都可以不要，快乐不能不要。这个世界不单为不平凡的人而存在，我们没有理由不为自己平凡而充实的、问心无愧的存在而高兴。	,正能量,positive
12,	【句句说到心坎上的文字】人在寂寞中有三种状态。一是惶惶不安，茫无头绪，百事无心，一心逃出寂寞。二是渐渐习惯于寂寞，安下心来，建立起生活的条理，用读书、写作或别的事务来驱逐寂寞。三是寂寞本身成为一片诗意的土壤，一种创造的契机，诱发出关于存在、生命、自我的深邃思考和体验。——周国平，《独处是一种能力》人生不可辜负的贵人：长期无条件支持你的人、对你不顺眼就唠叨的人、愿意和你分担责任分享快乐的人、欣赏而不嫉妒你长处的人、向你承诺并遵守承诺的人、愿意不放弃而相信你的人、生你气而不嫉恨的人、愿意和你一起吃苦的人、当你升迁不是恭维而是默默关注你的人、当你偏离人生轨迹时提醒你的人。	,正能量,positive
13,	时间回不到开始的地方。对于已经错过的一些东西，或许不用再试着去挽留。对于得到，我们都应该充满感激，对于失去，谁能保证那本该是属于你的？有些东西原本就是让你牵挂而不是获取的。世界变了，难忘的人，做过的梦，有过的期待，走过的路，有一些自己认为该珍惜的，现在又如何呢？鳄鱼妈妈骂小鳄鱼：“你怎不学学海豚宝宝？瞧！人家不但会游会跳，还会翻跟斗，多棒！”小鳄鱼说：妈妈先翻个给我看吧！点评：人各有长，也各有所用，各有发展。父母在逼孩子的时候，要先想想自己和孩子的所长所短。人人都该以自家的工作为荣，特质为傲，相信自己是世上的独一无二！	,正能量,positive
14,	【慧人慧语】越是复杂的环境就越要坚定、理智、果断地决策问题。一种思维不宜轻易形成，但是一经形成，并且又被事实验证是正确的，就一定要坚持下去，不可半途而废，直到最终结局的兑现。反复回味斟酌，对做过的事走过的路就会有深刻的认识，也能从中吸取一些有益的教训。那种做完了事走过不回顾的人，不可能增智慧长见识，只能是一而再再而三地重复走上正确的路。	,正能量,positive
15,	每一个人都期待着一份至死不渝的感情。要有足够的逃生设备应变。还有一点就是:所有的房子都一样，即使是监狱也有一扇可以进出的门。如果有一天，我变得更冷漠了，请记得，我曾经要人陪的时候你都只说忙；如果有一天，我变得目中无人了，请记得，曾经也没有人把我放在心里；如果有一天，我不再在乎你了，请记得，曾经也没人听过我的心事；如果有一天，我不再对你笑，请记得，你曾经也没有问我过的快不快乐。	,正能量,positive
16,	生命的豁然总会随着第一缕明媚到来。每天都有人离去，每天亦有人归来。不必纠结于离去，亦不必欣喜于归来。若真是灵魂的倒影，便无所谓归来与离去，自时时相随。若真是生命的意义，纵相距，亦相聚。一切皆源于心。------自己安心，即是佛心。如何从眼神看懂对方：初次见面时，先移开视线者，表示希望处于优势地位；被对方注视时，便立刻移开视线者，大都有自卑感或缺陷；看异性一眼后，随即故意移开视线者，表示有着强烈的兴趣；斜眼看对方者，表示对对方非常有兴趣，但又不想让对方识破。	yipinjuzi.com,正能量,positive
17,	我们必须承认，我们的许多成见和偏执，在生活当中成了自己的困惑和障碍，甚至别人的眉高眼低，都成了我们观察世界的标准。在自己的狭隘里，我们丢失了许多公正和客观，甚至别人的打嗝和放屁，也成了我们嘲笑的理由。需要自己清醒的是，我们自己的朴素和真实，才是人生真正的修养。如果看不清未来，那就努力做好现在。把眼前的事情做好了，机会自然会来。过去的你已经无法更改，未来的你什么样，取决于你的现在。如果你对未来感到迷茫，现在就放弃努力，那么你终将为今天的堕落付出代价。很多问题，不是靠想象就能解决的，你必须亲自去做，在行动中去消除障碍。	,正能量,positive
18,	人若简单，快乐便会相随；心若诗意，一切皆会美好。无需羡慕他人，自己也是风景，留一颗素心在尘世，给流年一个浅浅的回眸，淡看浮尘烟火，细品岁月静好，与世无争、与尘无染，飘然物外，在一朵花开的时间里行走、怀想，让纯净的念想贯穿一生，宠辱不惊，我自清欢，如此，便好。故当顺势，以卵击石易碎，螳臂挡车多伤；故当看开，一已之力有限，众人拾柴焰高；故当放下，可为时尽力，不可为时宽心。心若不复杂，人生也简单。世界复杂么？其实远比你想的简单得多；所谓的“复杂”，只不过是幻像对你的蒙骗。不必强求许多东西，把一切都看得淡然，也不必计较别人如何评断，不用在乎自己会不会一无所有，只专注于自己笃信的方向，并且把这种淡然与坚定渗透到生命当中，变成自己的人生态度与处世方式，如此，则成为自己心灵的主人，不再被这个纷纷扰扰的世界牵着走，也不再被自己生生灭灭的念头迷惑。	,正能量,positive
19,	5＋1＝3，是文学；1＋1＝2，是数学；1＋1＝0，是哲学。如果你周围是一群鹰的话，那么你自己也会成为一只鹰；如果是在一群山雀中间的话，那么你就看不到海阔天空。悲观者说人生是一杯苦酒，乐观者说人生是一杯香槟，悲观者说人生是一杯清水，乐观者说人生是一杯甘露。	,正能量,positive
20,	去抱怨，不浮躁，不害怕孤单，能很好的处理寂寞，沉默却又努力，那时说不定你想要苦苦追寻的梦想，已经握在你手中了。等你已经变成更好的你，继续勇敢地追寻下去等下去，真正能治愈自己的，只有你自己，总有一天，我们都能强大到什么都无法扰乱我们内心的平和。人一定要想清三个问题：第一你有什么，第二你要什么，第三你能放弃什么。对于多数人而言：有什么，很容易评价自己的现状；要什么，内心也有明确的想法；最难的是，不知道或不敢放弃什么——这点恰能决定你想要的东西能否真正实现，没有人可以不放弃就得到一切。	,正能量,positive
21,"	人活着，要有所追求，有所梦想，要生活得开心，快乐，这才是理想的人生。上天给我们机会，让我们来到世间走一遭，我们要珍惜，因为生命是如此的短暂，如果我们不知道珍惜，它将很快的逝去，到头来我们将一事无成。不要去羡慕别人的人生,你看见的,并不是他们经历的所有。你只羡慕他们的光鲜外表,却看不到他们为此付出的代价和努力。生活不是一定要有惊天动地的情节,才叫精彩。唯有努力，将来的你一定会感激现在拼命的自己。	",正能量,positive
22,	每个人都要成长，这是一条必经的路，也是一条逃避不了的路。不愿成长的人，只能被现实拉扯着跌跌撞撞向前，即使遍体鳞伤、血肉模糊。没人在乎你是否痛了，他们有他们的路要走，他们很忙；也没人能够替你承受，这些都得是自己承担，无可奈何，无可避免。经历多少动荡，才能看清一个人的内心。但为了那点输赢，我们总不愿承受一场动荡，所以从来没有机会真正了解一个人。一路平坦的感情，并无交集，只平行。心中的爱和思念，都只是属于自己曾经拥有过的纪念。有些事情是可以记念的，有些事情一直无能为力。	,正能量,positive
23,	生活每天充满了万般无奈，因此有时候，热闹与快乐是一种必须，但也掩盖不了寂寞与失落，生活、现实、理智、时间，最难过的，莫过于当你遇上一个特别的人，却明白永远不可能在一起，或迟或早，你都不得不放弃。虚荣心很难说是一种恶行，然而一切恶行都围绕虚荣心而生，都不过是满足虚荣心的手段。	,正能量,positive
24,	与小人交谈的基本原则：1不要和小人交往太深。2没有十足把握，不要轻率地揭发和攻击小人。3和小人说话要加倍小心，涉及个人隐私、对他人的抱怨和指责万不可对小人说。4不要试图和小人理论。5避免和小人有经济上的往来。6最好不要让小人知道你认为他是小人。	,正能量,positive
25,	健身在于健心，健心在于养神，养神在于养脑，养脑在于脑勤，脑勤用脑则强，脑强健命则长！未婚的想找知心爱人，结婚的想找完美情人，离婚的想要全部财产——做个理财达人。磨损;是一颗珍珠，深藏愈久，孕育越明。相反，是一枚浮叶，一堆泡沫或一头泥牛呢？那激情也会无情的吞没。	,正能量,positive
26,	不是流泪就能挽回失去的东西，所以不要轻易哭泣；不是伤心就一定低头，所以不要吝啬微笑；不是你认为可以给予就给予，所以不要轻易许诺；不是你一事无成，所以不要总是悲观地以为自己不行；不是只有你一个人在努力。所以不要轻易言弃。勇敢过了头，就成了鲁莽；诚信过了头，就成了迂腐；机敏过了头，就成了圆滑；施舍过了头，就成了乞丐；贪婪过了头，就成了腐败；执着过了头，就缺少心眼；善良过了头，就成了软弱；专横过了头，就成了霸道；做事过了头，就走上了绝路。	,正能量,positive
27,	我不让老婆生隔夜气，如果有矛盾，我永远100%先退第一步，男人和女人永远没有绝对和对和错……人生不是一支短短的蜡烛，而是一只由我们暂时拿着的火炬；我们一要把它燃得十分光明灿烂，然后交给下一代的人们。理智是人的最高天赋，是人本质上区别于低级动物的特征。理智的人使自己适应这个世界，不理智的人却硬要世界适应自己。	,正能量,positive
28,	你当下拥有的，就该喜爱与珍惜，不要轻言放弃，有些东西只有真正离去时，你才能领略无可挽回的痛。别说坚持是一种苦与罪，在最无望的时候咬牙忍住，或许希望就在峰回路转处。总有些事，管你愿不愿意，它都要发生，你只能接受；总有些东西，管你躲不躲避，它都要来临，你只能面对。微笑是一种消灭孤独、恐惧、愤怒、不安等等所有令人不安的正向力量。	,正能量,positive
29,	人生需要看透，但不能看破。人总是这样，对亲近的人太苛求，对陌生人显得过于宽容。叶散的时候，你明白欢聚；花谢的时候，你明白青春。你走过的每一条弯路，其实都是必经之路。你永远都无法借别人的翅膀，飞上自己的天空。	,正能量,positive
30,	一个是心存妒忌，一个是顾做清高。在这个世界上，如果没有钱，你就算有吕布之勇，诸葛之才，恐怕也是寸步难行。只要有钱，连至高至上的法律都能为你让路，难道这东西还不重要吗？南北洪门，门下帮众无数，没有钱，这些人有几个会拼死拼活的卖命。勇敢是一种斗争精神。面对邪恶、困难，一个勇敢者必须毫不畏惧地去斗争，去拼搏；勇敢是一种创造精神，面对未来、希望，一个勇敢者应该毫不退缩地去创造，去开拓；勇敢是一种牺牲精神，为了正义、真理，一个勇敢者必须毫不犹豫地去牺牲，去献身。	,正能量,positive
31,	【慧语经典名句】生活如水，人生似茶，再好的茶放到水中一泡，时间久了，也就淡了。人生步入另外一种境界，—淡然。得与失，成和败，聚或散，虽然一样渴望一切都好，但也能安然地接受一切不好。淡然，是人生的一种成长！做你自己想做的，而不是别人想看到的。很多人不快乐，因为总觉得过去太美好，现在太糟糕，将来又太飘渺。颠颠撞撞间，我们已然长大，即使是有些事情看来像是回头的事，也都是去面对着完成的。我们可以转身，但是不必回头，你应该大步朝着对的方向去，而不是回头怨自己错了。	,正能量,positive
32,	【说到心坎的句子】多一些宽容，多一些大度，挥挥手，笑一笑，一切的不愉快都会成为过去。生命的完整，在于宽恕、容忍、等待与爱，如果没有这一切，拥有了所有，也是虚无。逆境时，不妨换一个角度来思考，凡事往好处想，好的心态决定好的命运！生命是一个迷，我们永远不知道下一步会是怎么样，会出现一个怎么样的局面，那么就让我们做一个优秀的演员吧，尽情的去投入，该笑的时候就开心的笑，该哭的时候就痛快的哭，该爱的时候就爱他个轰轰烈烈，该恨的时候就恨他个彻彻底底。用我们生命里所有的时间和精力，所有的真心和真情，所有的欢笑和泪水，去演绎这场生命之剧，使自己的角色完美无暇，那么在剧终谢幕的时候，肯定会有人流着泪水给予我们最热烈的掌声。	,正能量,positive
33,	在人的一生中，会遇到许许多多的人和事，有些是完全用不着的，比如名利、贪心、虚荣、嫉妒等等。这些，都是负担，应该果断地删除它！就像电脑中的垃圾文件一样，及时删除，操作才能顺利进行。人生，就是一步一步走，一步一步扔。走出来的是路，扔掉的是包袱。这样，路就会越走越长，心就会越走越静。逝水流年，笑过，沧海桑田，经历过，人情冷暖，承受过，缘深缘浅，痛过。生命旅程就是一场奔波，一路的沟坎，不停地跨越，一路的酸辛，不断的超越，一路上成熟着、感恩着。赏一场春花，看一季落红，珍藏一份懂得，旅途匆匆，只是一场得失兼容的路过，放逐一份心情，还灵魂一份洒脱，让生命一路欢歌。	,正能量,positive
34,	【描写人生哲理的句子】当距离不再是距离的时候，我们一定会相遇，结成水，凝成冰，亦或，化作尘埃但愿你是我最美的风景，我是你久等的归人。与许多人相遇，又有许多人离开，而现在还有许多人留在我身边，因为我们都是迎向那遥远旅途的人，所以对离开的人留下回忆，留下的人也必须继续活下去。好的坏的我们都收下吧，然后一声不响，继续生活。人前逞强，是为学会遗忘；人后惆怅，是因为学不会伪装。其实，我们都只是孤单的孩子，渴望有人疼，渴望有人爱，渴望身边的人永远不对自己说拜拜。	,正能量,positive
35,"	【字字珠玑】不是说你象杯具,只是你一看到杯具时就爱做杯具的动作不是说你是杯具,只是你不断从一个杯具换到另一个杯具时不知道是自己在不停地换不相信空话的人未必不讲空话，相信真理的人未必坚持真理—皆因身不由己。常常告诫自己不要在一颗树上调死，结果，在树林里迷路了……如果感到郁闷，请拨打俺的电话！谈感情请按，谈工作请按，谈人生请按，给俺介绍对象请按，请俺吃饭请大声直说，找俺借钱庆直接挂机。	",正能量,positive
36,	【很有哲理的句子】世界上能登上金字塔顶的生物只有两种：一种是鹰，一种是蜗牛。不管是天资奇佳的鹰，还是资质平庸的蜗牛，能登上塔尖，极目四望，俯视万里，都离不开两个字——勤奋。很多时候，一个人的能力高低并不是最重要的，最重要的是，你要以勤奋的态度……付出汗水，终会有回报。离开永远比相遇更容易，因为相遇是几亿人中一次的缘分，而离开只是两个人的结局。相遇难，分手易，但世人看不到有缘无份的熙攘，总以为机会无限，所以不珍惜眼前人。人呀，总是这样，悲伤时要一个肩膀，而开心时拥抱全世界。时光偷走的，永远是你眼皮底下看不见的珍贵。	,正能量,positive
37,	路是自己走出来的，没有什么后悔的理由。人生两种境界：一是痛而不言，二是笑而不语。痛而不言是种智慧，人生在世，往往会因这样或那样的伤害而心痛不已。人生的路上，如果缺少体谅，不能理解，没有谦让，日子就会越过越烦恼。	,正能量,positive
38,	变老是人生的必修课，变成熟是人生的选修课。总盯着了不起的过去，就不会有了不起的将来。天气影响身体，身体决定思想，思想左右心情。跛足而不迷路能赶上虽健步如飞但误入歧途的。成大事不在于力量的大小，而在于能坚持多久。	,正能量,positive
39,	有些事情我们必须放弃，才有精力去迎接更美好的生活。其实孩子气，也没什么不好。人总有一天会长大，何必成熟太早，失去太早。未来的路，我们谁也说不清楚，什么时候醒来，什么时候又睡着了，路的尽头有什么，这些我们都无从知晓。岁月，就会这样一点一点的流逝，人生之苦，不在最初，而是他年后涌起的感受。有缘而来，无缘而去，世上之事就是这样，该来的自然会来，不该来的盼也无用，求也无益。有缘不推，无缘不求，来的欢迎，去的目送，一切随缘，顺其自然。	,正能量,positive
